{
  "schema_version": "1.0",
  "strategy_id": "template_price_breakout_entry_threshold_1670_exit_threshold_1670_order_size_0_2",
  "name": "价格突破策略",
  "description": "收盘价高于 1680 买入，收盘价低于 1670 卖出。",
  "market": "a_share",
  "universe": {
    "type": "single",
    "symbols": [
      "600519.SH"
    ]
  },
  "data": {
    "frequency": "1d",
    "adjustment": "none",
    "start_date": "2018-01-01",
    "end_date": "2025-12-31"
  },
  "entry": {
    "logic": "all",
    "conditions": [
      {
        "left": {
          "type": "price",
          "field": "close"
        },
        "operator": "gt",
        "right": {
          "type": "constant",
          "value": 1670
        }
      }
    ]
  },
  "exit": {
    "logic": "any",
    "conditions": [
      {
        "left": {
          "type": "price",
          "field": "close"
        },
        "operator": "lt",
        "right": {
          "type": "constant",
          "value": 1670
        }
      }
    ]
  },
  "position": {
    "initial_cash": 1000000,
    "order_size_type": "cash_pct",
    "order_size_value": 0.2,
    "max_position_pct": 0.8
  },
  "execution": {
    "entry_price": "current_close",
    "exit_price": "current_close",
    "commission_rate": 0.00025,
    "slippage_rate": 0.0005
  },
  "risk": {
    "stop_loss_pct": 0.08,
    "take_profit_pct": 0.2,
    "max_drawdown_pct": 0.15,
    "max_holding_bars": null
  },
  "metadata": {
    "template_id": "tpl_price_breakout",
    "created_by": "template_library",
    "created_at": "2026-06-20T00:00:00Z",
    "updated_at": "2026-10-24T00:00:00Z",
    "optimization_params": {
      "entry_threshold": 1670,
      "exit_threshold": 1670,
      "order_size": 0.2
    }
  }
}