{
  "schema_version": "1.0",
  "strategy_id": "template_double_ma_trend",
  "name": "双均线趋势策略",
  "description": "MA5 上穿 MA20 买入，MA5 下穿 MA20 卖出。",
  "market": "a_share",
  "universe": {
    "type": "single",
    "symbols": [
      "600519.SH"
    ]
  },
  "data": {
    "frequency": "1d",
    "adjustment": "forward",
    "start_date": "2018-01-01",
    "end_date": "2025-12-31"
  },
  "entry": {
    "logic": "all",
    "conditions": [
      {
        "left": {
          "type": "indicator",
          "name": "MA",
          "params": {
            "period": 5,
            "field": "close"
          }
        },
        "operator": "cross_above",
        "right": {
          "type": "indicator",
          "name": "MA",
          "params": {
            "period": 20,
            "field": "close"
          }
        }
      }
    ]
  },
  "exit": {
    "logic": "any",
    "conditions": [
      {
        "left": {
          "type": "indicator",
          "name": "MA",
          "params": {
            "period": 5,
            "field": "close"
          }
        },
        "operator": "cross_below",
        "right": {
          "type": "indicator",
          "name": "MA",
          "params": {
            "period": 20,
            "field": "close"
          }
        }
      }
    ]
  },
  "position": {
    "initial_cash": 1000000,
    "order_size_type": "cash_pct",
    "order_size_value": 0.3,
    "max_position_pct": 0.8
  },
  "execution": {
    "entry_price": "next_open",
    "exit_price": "next_open",
    "commission_rate": 0.00025,
    "slippage_rate": 0.0005
  },
  "risk": {
    "stop_loss_pct": 0.08,
    "take_profit_pct": 0.2,
    "max_drawdown_pct": 0.15,
    "max_holding_bars": null
  },
  "metadata": {
    "template_id": "tpl_double_ma_trend",
    "created_by": "template_library",
    "created_at": "2026-06-20T00:00:00Z",
    "updated_at": "2026-10-24T00:00:00Z"
  }
}
