{
  "schema_version": "1.0",
  "strategy_id": "template_volume_breakout",
  "name": "成交量突破策略",
  "description": "收盘价高于 9.34 且成交量高于 3 周期均量时买入，收盘价低于 9.32 时卖出。",
  "market": "a_share",
  "universe": {
    "type": "single",
    "symbols": [
      "000001.SZ"
    ]
  },
  "data": {
    "frequency": "15m",
    "adjustment": "none",
    "start_date": "2018-01-01",
    "end_date": "2025-12-31"
  },
  "entry": {
    "logic": "all",
    "conditions": [
      {
        "left": {
          "type": "price",
          "field": "close"
        },
        "operator": "gt",
        "right": {
          "type": "constant",
          "value": 9.34
        }
      },
      {
        "left": {
          "type": "price",
          "field": "volume"
        },
        "operator": "gt",
        "right": {
          "type": "indicator",
          "name": "VOLUME_MA",
          "params": {
            "period": 3
          }
        }
      }
    ]
  },
  "exit": {
    "logic": "any",
    "conditions": [
      {
        "left": {
          "type": "price",
          "field": "close"
        },
        "operator": "lt",
        "right": {
          "type": "constant",
          "value": 9.32
        }
      }
    ]
  },
  "position": {
    "initial_cash": 1000000,
    "order_size_type": "cash_pct",
    "order_size_value": 0.2,
    "max_position_pct": 0.6
  },
  "execution": {
    "entry_price": "current_close",
    "exit_price": "current_close",
    "commission_rate": 0.00025,
    "slippage_rate": 0.0005
  },
  "risk": {
    "stop_loss_pct": 0.04,
    "take_profit_pct": 0.08,
    "max_drawdown_pct": 0.1,
    "max_holding_bars": 8
  },
  "metadata": {
    "template_id": "tpl_volume_breakout",
    "created_by": "template_library",
    "created_at": "2026-06-20T00:00:00Z",
    "updated_at": "2026-10-24T00:00:00Z"
  }
}
