{
  "schema_version": "1.0",
  "strategy_id": "strategy_price_breakout_demo_600519",
  "name": "价格突破演示策略",
  "description": "用于第五阶段回测引擎验证：收盘价高于 1680 买入，收盘价低于 1670 卖出。",
  "market": "a_share",
  "universe": {
    "type": "single",
    "symbols": ["600519.SH"]
  },
  "data": {
    "frequency": "1d",
    "adjustment": "forward",
    "start_date": "2024-01-02",
    "end_date": "2024-01-08"
  },
  "entry": {
    "logic": "all",
    "conditions": [
      {
        "left": {
          "type": "price",
          "field": "close"
        },
        "operator": "gt",
        "right": {
          "type": "constant",
          "value": 1680
        }
      }
    ]
  },
  "exit": {
    "logic": "any",
    "conditions": [
      {
        "left": {
          "type": "price",
          "field": "close"
        },
        "operator": "lt",
        "right": {
          "type": "constant",
          "value": 1670
        }
      }
    ]
  },
  "position": {
    "initial_cash": 100000,
    "order_size_type": "cash_pct",
    "order_size_value": 0.3,
    "max_position_pct": 0.8
  },
  "execution": {
    "entry_price": "current_close",
    "exit_price": "current_close",
    "fee_rate": 0.0003,
    "slippage_rate": 0.0005
  },
  "risk": {
    "stop_loss_pct": 0.08,
    "take_profit_pct": 0.2,
    "max_drawdown_pct": 0.15,
    "max_holding_bars": null
  },
  "metadata": {
    "created_by": "prototype",
    "created_at": "2026-06-20T00:00:00Z",
    "updated_at": "2026-06-20T00:00:00Z"
  }
}
