{
  "schema_version": "1.0",
  "strategy_id": "strategy_rsi_reversal_000001",
  "name": "RSI 波段反转策略",
  "description": "RSI 低于 30 买入，RSI 高于 70 卖出，适用于 A 股单标的波段回测。",
  "market": "a_share",
  "universe": {
    "type": "single",
    "symbols": ["000001.SZ"]
  },
  "data": {
    "frequency": "1d",
    "adjustment": "forward",
    "start_date": "2024-01-02",
    "end_date": "2024-01-08"
  },
  "entry": {
    "logic": "all",
    "conditions": [
      {
        "left": {
          "type": "indicator",
          "name": "RSI",
          "params": { "period": 14, "field": "close" }
        },
        "operator": "lt",
        "right": {
          "type": "constant",
          "value": 30
        }
      }
    ]
  },
  "exit": {
    "logic": "any",
    "conditions": [
      {
        "left": {
          "type": "indicator",
          "name": "RSI",
          "params": { "period": 14, "field": "close" }
        },
        "operator": "gt",
        "right": {
          "type": "constant",
          "value": 70
        }
      }
    ]
  },
  "position": {
    "initial_cash": 100000,
    "order_size_type": "cash_pct",
    "order_size_value": 0.25,
    "max_position_pct": 0.6
  },
  "execution": {
    "entry_price": "next_open",
    "exit_price": "next_open",
    "fee_rate": 0.0003,
    "slippage_rate": 0.0005
  },
  "risk": {
    "stop_loss_pct": 0.06,
    "take_profit_pct": 0.15,
    "max_drawdown_pct": 0.12,
    "max_holding_bars": 20
  },
  "metadata": {
    "created_by": "prototype",
    "created_at": "2026-06-20T00:00:00Z",
    "updated_at": "2026-06-20T00:00:00Z"
  }
}
