{
  "schema_version": "1.0",
  "strategy_id": "strategy_double_ma_600519",
  "name": "双均线趋势策略",
  "description": "MA5 上穿 MA20 买入，MA5 下穿 MA20 卖出，适用于 A 股单标的趋势跟随回测。",
  "market": "a_share",
  "universe": {
    "type": "single",
    "symbols": ["600519.SH"]
  },
  "data": {
    "frequency": "1d",
    "adjustment": "forward",
    "start_date": "2024-01-02",
    "end_date": "2024-01-08"
  },
  "entry": {
    "logic": "all",
    "conditions": [
      {
        "left": {
          "type": "indicator",
          "name": "MA",
          "params": { "period": 5, "field": "close" }
        },
        "operator": "cross_above",
        "right": {
          "type": "indicator",
          "name": "MA",
          "params": { "period": 20, "field": "close" }
        }
      }
    ]
  },
  "exit": {
    "logic": "any",
    "conditions": [
      {
        "left": {
          "type": "indicator",
          "name": "MA",
          "params": { "period": 5, "field": "close" }
        },
        "operator": "cross_below",
        "right": {
          "type": "indicator",
          "name": "MA",
          "params": { "period": 20, "field": "close" }
        }
      }
    ]
  },
  "position": {
    "initial_cash": 100000,
    "order_size_type": "cash_pct",
    "order_size_value": 0.3,
    "max_position_pct": 0.8
  },
  "execution": {
    "entry_price": "next_open",
    "exit_price": "next_open",
    "fee_rate": 0.0003,
    "slippage_rate": 0.0005
  },
  "risk": {
    "stop_loss_pct": 0.08,
    "take_profit_pct": 0.2,
    "max_drawdown_pct": 0.15,
    "max_holding_bars": null
  },
  "metadata": {
    "created_by": "prototype",
    "created_at": "2026-06-20T00:00:00Z",
    "updated_at": "2026-06-20T00:00:00Z"
  }
}
